Date,Name,Start,End,Duration,Latitude,Longitude,Category,Link
9/13/14,Place in Fort Tuthill,2014-09-13T11:06:15-07:00,2014-09-13T17:25:16-07:00,22741,35.1378607437,-111.6924324721,,
9/13/14,Place in Kachina Village,2014-09-13T17:49:18-07:00,2014-09-13T20:16:24-07:00,8826,35.0916765295,-111.6999361503,,
9/13/14,Place in Downtown Flagstaff,2014-09-13T20:36:02-07:00,2014-09-13T20:38:40-07:00,158,35.1993103247,-111.6460783374,,
9/13/14,Place in Downtown Flagstaff,2014-09-13T20:42:10-07:00,2014-09-13T23:38:56-07:00,10606,35.1976058633,-111.6484277581,,
9/13/14,Place in Kachina Village,2014-09-13T23:55:26-07:00,2014-09-14T00:00:00-07:00,274,35.0911273269,-111.6993766135,,
